{"$schema":"https://json-schema.org/draft/2020-12/schema","title":"Atlas AI Claims Registry Record","type":"object","required":["claim_id","claim","category","evidence_ref","approval_status","owner","review_date"],"properties":{"claim_id":{"type":"string"},"claim":{"type":"string"},"category":{"type":"string"},"evidence_ref":{"type":"string"},"approval_status":{"enum":["draft","pending_review","approved_internal","approved_legal","pending_evidence","retired"]},"owner":{"type":"string"},"review_date":{"type":"string"}}}
