[{"claim_id":"C-001","claim":"Atlas AI is a governed AI solution layer, not a proprietary foundation-model company.","category":"positioning","evidence_ref":"Atlas AI Research Dossier 03:00 04.06.2026; Board Review Package 03:04 04.06.2026","owner":"Atlas governance","approval_status":"approved_internal","review_date":"2026-06-04"},{"claim_id":"C-002","claim":"Vendor subscriptions and API usage are BYOL/pass-through by default unless expressly included.","category":"pricing","evidence_ref":"Cost/Margin/Price Analysis 11:12 04.06.2026","owner":"Commercial","approval_status":"approved_internal","review_date":"2026-06-04"},{"claim_id":"C-003","claim":"Ordinary public forms are low-risk qualification only and must not collect confidential/restricted files.","category":"security_privacy","evidence_ref":"Phase 2 and Phase 6 website strategy updates 12:27 04.06.2026","owner":"Security/privacy","approval_status":"approved_internal","review_date":"2026-06-04"},{"claim_id":"C-004","claim":"Managed Secure public security claims require identity, access, revocation, audit, isolation, backup/recovery and incident evidence.","category":"managed_secure","evidence_ref":"Phase 4 and Phase 6 website strategy updates 12:27 04.06.2026","owner":"Security/privacy","approval_status":"pending_evidence","review_date":"2026-06-04"}]
